{"schema":"python-slm-backend-candidate-result-v1","candidate_id":"candle","mode":"correctness","status":"FAIL","workload":"correctness","fixture_hashes":{"algorithm":"sha256","a_sha256":"3a0438fe000928d4384c01166604631d32f2ff4f9e341ba58bd81912c3fecddc","b_sha256":"501883a6afa454243ac78dee6a6940301ba4eee81ea8b33fde86a997a351d182","a_elements":527,"b_elements":899},"allocation":null,"correctness":{"shape":{"m":17,"k":31,"n":29},"accumulation":"fp32","output_dtype":"bf16","loss_dtype":"fp32","forward":{"elements":493,"max_absolute_error":0.01568603515625,"max_relative_error":2.1743119266055047,"relative_l2":0.002457713176405997,"cosine_similarity":0.999996981463106,"envelope_violation_count":1},"loss":{"actual":3.1062440872192383,"reference":3.1066193262202018,"absolute_error":0.00037523900096347873,"allowed_error":0.03107619326220202,"passed":true},"grad_a":{"elements":527,"max_absolute_error":0.00030923034791772996,"max_relative_error":1.483430490432138,"relative_l2":0.002671937982128336,"cosine_similarity":0.9999965597719535,"envelope_violation_count":0},"grad_b":{"elements":899,"max_absolute_error":0.00025409327075640725,"max_relative_error":0.5544899165736057,"relative_l2":0.0032427788635523724,"cosine_similarity":0.9999948433752301,"envelope_violation_count":0},"nan_count":0,"infinite_count":0,"envelope_violation_count":1},"timing":null,"memory":null,"provenance":{"crate_name":"candle-core","crate_version":"0.11.0","feature_set":["cuda"],"device":"CUDA device 0","device_ordinal":0,"explicit_synchronization":true,"fp32_accumulation_evidence":"runtime_getter=candle_core::cuda::gemm_reduced_precision_bf16;observed=false;compute=CUBLAS_COMPUTE_32F","framework_rng_used":false},"diagnostics":[{"code":"CANDIDATE_EXECUTION_FAILED","message":"Candle correctness metrics failed the frozen tolerances"}]}
