{"schema":"python-slm-backend-candidate-result-v1","candidate_id":"candle","mode":"cpu-smoke","status":"PASS","workload":"correctness","fixture_hashes":{"algorithm":"sha256","a_sha256":"3a0438fe000928d4384c01166604631d32f2ff4f9e341ba58bd81912c3fecddc","b_sha256":"501883a6afa454243ac78dee6a6940301ba4eee81ea8b33fde86a997a351d182","a_elements":527,"b_elements":899},"allocation":null,"correctness":null,"timing":null,"memory":null,"provenance":{"crate_name":"candle-core","crate_version":"0.11.0","feature_set":[],"device":"CPU","device_ordinal":null,"explicit_synchronization":true,"fp32_accumulation_evidence":"unverified-until-cuda-run","framework_rng_used":false},"diagnostics":[]}
