{"schema":"python-slm-backend-candidate-result-v1","candidate_id":"candle","mode":"correctness","status":"PASS","workload":"allocation","fixture_hashes":{"algorithm":"sha256","a_sha256":"9b707d439be74adc6b224c46fdba78b82ee590b083fc28d7933be0cc99037bee","b_sha256":null,"a_elements":25165824,"b_elements":0},"allocation":{"shape":[16,2048,768],"elements":25165824,"input_sha256":"9b707d439be74adc6b224c46fdba78b82ee590b083fc28d7933be0cc99037bee","output_sha256":"9b707d439be74adc6b224c46fdba78b82ee590b083fc28d7933be0cc99037bee","bitwise_equal":true},"correctness":null,"timing":null,"memory":{"free_bytes_after_context":32425115648,"free_bytes_after_allocation":32358006784,"free_bytes_after_forward":null,"free_bytes_after_backward":null},"provenance":{"crate_name":"candle-core","crate_version":"0.11.0","feature_set":["cuda"],"device":"CUDA device 0","device_ordinal":0,"explicit_synchronization":true,"fp32_accumulation_evidence":"runtime_getter=candle_core::cuda::gemm_reduced_precision_bf16;observed=false;compute=CUBLAS_COMPUTE_32F","framework_rng_used":false},"diagnostics":[]}
